{
  "schema_version": "2.0",
  "date": "2026-10-22",
  "window": {
    "start": "2026-10-21T00:28:26Z",
    "end": "2026-10-22T06:34:51Z",
    "timezone": "Asia/Shanghai"
  },
  "headline": "How AT&T is rethinking in-house legal work with OpenAI",
  "modules": [
    {
      "id": "model",
      "index": "01",
      "title": "模型新闻",
      "desc": "新模型、版本发布与榜单",
      "count": 9
    },
    {
      "id": "opensource",
      "index": "02",
      "title": "开源项目发现",
      "desc": "新仓库、热门模型权重与工具发布",
      "count": 6
    },
    {
      "id": "community",
      "index": "03",
      "title": "社区新闻",
      "desc": "HN、Reddit 与 X 上的讨论",
      "count": 14
    }
  ],
  "items": [
    {
      "id": "sha256:39cad894cdd240fbe2dba606200e547216d43a1655f56c86db3d6329a851a826",
      "module": "model",
      "kind": "post",
      "title": "How AT&T is rethinking in-house legal work with OpenAI",
      "excerpt": "AT&T is working with OpenAI to make legal knowledge easier to access. Learn how its LegalEdge team is rethinking intake and scaling legal judgment.",
      "url": "https://openai.com/index/att-legal",
      "source": "rss",
      "source_label": "openai-news",
      "published_at": "2026-10-21T17:00:00Z",
      "metrics": {},
      "tags": [
        "AI"
      ],
      "keywords": [
        "OpenAI"
      ],
      "score": {
        "total": 68.47,
        "engagement": 0.5,
        "specificity": 0.7,
        "decay": 0.806,
        "source_weight": 1.25
      },
      "links": [],
      "visibility": "public",
      "batch": "am",
      "fetched_at": "2026-10-22T00:28:26Z",
      "title_zh": "AT&T 用 OpenAI 重做法务入口",
      "summary_zh": "AT&T 正与 OpenAI 合作，让法律知识更易获取；LegalEdge 团队重做需求接收并扩大法律判断覆盖。"
    },
    {
      "id": "sha256:94a5f6526eada9bc0f52700eb51d921a09fcfe01b2b364c8982be81ac1418089",
      "module": "model",
      "kind": "post",
      "title": "NVIDIA Kumo Relational Outperforms Supervised Machine Learning on Relational Data, No Training Required",
      "excerpt": "NVIDIA Kumo Relational Outperforms Supervised Machine Learning on Relational Data, No Training Required TL;DR NVIDIA Kumo Relational is a pre-trained relational foundation model that makes predictions directly on enterpr…",
      "url": "https://huggingface.co/blog/nvidia/kumo-relational",
      "source": "rss",
      "source_label": "hf-blog",
      "published_at": "2026-10-21T18:26:30Z",
      "metrics": {},
      "tags": [
        "AI"
      ],
      "keywords": [
        "Hugging Face",
        "NVIDIA",
        "machine learning"
      ],
      "score": {
        "total": 62.75,
        "engagement": 0.5,
        "specificity": 0.4,
        "decay": 0.84,
        "source_weight": 1.25,
        "feedback": 1.0782,
        "feedback_why": [
          "feed:hf-blog"
        ]
      },
      "links": [],
      "visibility": "public",
      "batch": "am",
      "fetched_at": "2026-10-22T00:28:26Z",
      "image": {
        "src": "https://cdn-uploads.huggingface.co/production/uploads/6ad8e88370f69967fafc8703/i-Flass3NMPRmc6lVfwO_.png",
        "width": 8621,
        "height": 4656,
        "alt": "",
        "type": "image",
        "logo": false
      },
      "title_zh": "NVIDIA Kumo 无需训练也能预测",
      "summary_zh": "NVIDIA Kumo Relational 是预训练关系基础模型，可直接预测关系数据，表现超过监督机器学习。",
      "comment_zh": "关系数据预测也开始从专门训练转向直接调用基础模型。"
    },
    {
      "id": "sha256:40a01666d562060bfdf96e1bee46311ea36b1fbc4128b476c54664266fe1cab8",
      "module": "model",
      "kind": "post",
      "title": "How Specializing the Vocabulary of SLMs Can Cut Inference Cost by 77% in Real Applications",
      "excerpt": "How Specializing the Vocabulary of SLMs Can Cut Inference Cost by 77% in Real Applications Models specialized for a domain or a task by fine-tuning general open-source models, such as Qwen and Gemma, inherit a vocabulary…",
      "url": "https://huggingface.co/blog/Dharma-AI/vocabx-vocabulary-specialization",
      "source": "rss",
      "source_label": "hf-blog",
      "published_at": "2026-10-21T17:35:36Z",
      "metrics": {},
      "tags": [
        "AI",
        "LLM"
      ],
      "keywords": [
        "AI",
        "Hugging Face",
        "inference"
      ],
      "score": {
        "total": 55.59,
        "engagement": 0.5,
        "specificity": 0.25,
        "decay": 0.82,
        "source_weight": 1.25,
        "feedback": 1.0782,
        "feedback_why": [
          "feed:hf-blog"
        ]
      },
      "links": [],
      "visibility": "public",
      "batch": "am",
      "fetched_at": "2026-10-22T00:28:26Z",
      "image": {
        "src": "https://cdn-uploads.huggingface.co/production/uploads/6a725daa5ca641a21ab61956/OWGtXjnbBov-7SI_04o4z.png",
        "width": 1200,
        "height": 648,
        "alt": "",
        "type": "image",
        "logo": false
      },
      "title_zh": "专用词表让 SLM 推理成本降77%",
      "summary_zh": "研究称，为 Qwen、Gemma 等开源模型按领域或任务定制词表，真实应用中的推理成本可降低 77%。"
    },
    {
      "id": "sha256:960f266d21e0fb40388f605cf4f6ef48c3638089e09c99d1b89426b132ffb33f",
      "module": "model",
      "kind": "post",
      "title": "Open-weights models beat every closed model on long documents: Kimi K3 scores 88.7% on AA-LCR, ahead of Claude Fable 5.1 (@AnthropicAI) at 85.3%.",
      "excerpt": "",
      "url": "https://x.com/merge_api/status/2112906760604270669",
      "source": "x",
      "source_label": "X · @merge_api",
      "published_at": "2026-10-21T14:00:02Z",
      "metrics": {
        "engagement": 35,
        "replies": 5,
        "likes_x": 33,
        "reposts": 1
      },
      "tags": [
        "AI",
        "LLM"
      ],
      "keywords": [
        "Claude",
        "GPT",
        "GPT-5",
        "Kimi",
        "model",
        "open weights"
      ],
      "score": {
        "total": 49.73,
        "engagement": 0.373,
        "specificity": 1,
        "decay": 0.739,
        "source_weight": 0.9
      },
      "links": [],
      "visibility": "public",
      "batch": "am",
      "fetched_at": "2026-10-22T00:28:26Z",
      "image": {
        "src": "https://pbs.twimg.com/media/HVKNf8CWQAAqZoN?format=jpg&name=large",
        "srcset": "https://pbs.twimg.com/media/HVKNf8CWQAAqZoN?format=jpg&name=small 680w, https://pbs.twimg.com/media/HVKNf8CWQAAqZoN?format=jpg&name=medium 1200w, https://pbs.twimg.com/media/HVKNf8CWQAAqZoN?format=jpg&name=large 2048w, https://pbs.twimg.com/media/HVKNf8CWQAAqZoN?format=jpg&name=orig 3840w",
        "width": 3840,
        "height": 2160,
        "alt": "",
        "logo": false
      },
      "author": {
        "handle": "merge_api",
        "name": "Merge",
        "avatar": "https://pbs.twimg.com/profile_images/2079671168269987840/PBpGK8rM_400x400.jpg",
        "verified": true
      },
      "title_zh": "Kimi K3 长文档评测超过闭源模型",
      "summary_zh": "网友称 AA-LCR 中 Kimi K3 得88.7%，Claude Fable 5.1 得85.3%。"
    },
    {
      "id": "sha256:3f1a11956436b167380065dcbfb11acfb4b7400895eeef122ae6e9ec1be674ee",
      "module": "model",
      "kind": "post",
      "title": "Broad access through consistent standards",
      "excerpt": "How OpenAI works with distribution partners to uphold consistent safeguards, support responsible access, and clarify expectations in our Usage Policies.",
      "url": "https://openai.com/index/broad-access-through-consistent-standards",
      "source": "rss",
      "source_label": "openai-news",
      "published_at": "2026-10-21T21:00:00Z",
      "metrics": {},
      "tags": [
        "AI"
      ],
      "keywords": [
        "OpenAI"
      ],
      "score": {
        "total": 48.31,
        "engagement": 0.5,
        "specificity": 0.1,
        "decay": 0.905,
        "source_weight": 1.25
      },
      "links": [],
      "visibility": "public",
      "batch": "am",
      "fetched_at": "2026-10-22T00:28:26Z",
      "title_zh": "OpenAI 与分发伙伴统一安全标准",
      "summary_zh": "OpenAI 将与分发伙伴统一安全措施，支持负责任访问，并明确 Usage Policies 要求。"
    },
    {
      "id": "sha256:5b4e08461387ba3b44832eb32623a231bc98422af2b9c0aa208f73f388840205",
      "module": "model",
      "kind": "post",
      "title": "Profiling TorchNeuron (Part 1): System-level profiling on AWS Trainium.",
      "excerpt": "Profiling TorchNeuron (Part 1): System-level profiling on AWS Trainium. Many ML practitioners have some intuition about how to make models run fast, but fewer know how to analyze why a model is slow.",
      "url": "https://huggingface.co/blog/amazon/profiling-torchneuron-part-1",
      "source": "rss",
      "source_label": "hf-blog",
      "published_at": "2026-10-21T16:04:43Z",
      "metrics": {},
      "tags": [
        "AI"
      ],
      "keywords": [
        "Hugging Face"
      ],
      "score": {
        "total": 48.12,
        "engagement": 0.5,
        "specificity": 0.1,
        "decay": 0.785,
        "source_weight": 1.25,
        "feedback": 1.0782,
        "feedback_why": [
          "feed:hf-blog"
        ]
      },
      "links": [],
      "visibility": "public",
      "batch": "am",
      "fetched_at": "2026-10-22T00:28:26Z",
      "image": {
        "src": "https://cdn-uploads.huggingface.co/production/uploads/6ac67ea29579ea34f1f7e470/hEodPVvQZI24jETLbPooP.png",
        "width": 3824,
        "height": 1530,
        "alt": "",
        "type": "image",
        "logo": false
      },
      "title_zh": "TorchNeuron 性能分析，从系统层找瓶颈",
      "summary_zh": "系列首篇聚焦 AWS Trainium 的系统级性能分析，讲解如何排查模型运行缓慢的原因。"
    },
    {
      "id": "sha256:b1215e1aefc04c61e203617a80fd84e7760e29072f8e8c5c2b0a50c22fe019fd",
      "module": "model",
      "kind": "post",
      "title": "ChatGPT Ads expands to 26 new countries as over 100,000 advertisers have used the platform",
      "excerpt": "From local businesses to global brands, more advertisers can now reach people as they explore, compare and decide what to buy in ChatGPT.",
      "url": "https://openai.com/index/chatgpt-ads-expands-26-new-countries",
      "source": "rss",
      "source_label": "openai-news",
      "published_at": "2026-10-21T13:00:00Z",